[
  {
    "id": "whois",
    "display_name": "WHOIS Lookup",
    "category": "osint",
    "binary_path": "/usr/bin/whois",
    "allowed_personas": ["anonymous", "red_team", "i2p_research"],
    "denied_personas": ["real_identity"],
    "denied_security_modes": ["casual"],
    "max_runtime_seconds": 30,
    "output_to_quarantine": false,
    "requires_network": true,
    "audit_level": "standard",
    "notes": "WHOIS domain and IP registration lookups. Denied for real_identity to prevent accidental attribution."
  },
  {
    "id": "dig",
    "display_name": "DNS Query (dig)",
    "category": "osint",
    "binary_path": "/usr/bin/dig",
    "allowed_personas": [],
    "denied_personas": [],
    "denied_security_modes": ["casual"],
    "max_runtime_seconds": 15,
    "output_to_quarantine": false,
    "requires_network": true,
    "audit_level": "standard",
    "notes": "DNS record queries. Empty allowed_personas means any persona may invoke."
  },
  {
    "id": "nmap-quick",
    "display_name": "Nmap Quick Scan",
    "category": "network_scan",
    "binary_path": "/usr/bin/nmap",
    "allowed_personas": ["red_team"],
    "denied_personas": [],
    "denied_security_modes": ["casual", "airgap"],
    "max_runtime_seconds": 120,
    "output_to_quarantine": true,
    "requires_network": true,
    "audit_level": "full",
    "notes": "Fast port scan. Output routed to BlackVault quarantine. Restricted to red_team persona only."
  },
  {
    "id": "curl-fetch",
    "display_name": "HTTP Fetch (curl)",
    "category": "web",
    "binary_path": "/usr/bin/curl",
    "allowed_personas": ["anonymous", "red_team", "i2p_research"],
    "denied_personas": ["real_identity"],
    "denied_security_modes": ["casual"],
    "max_runtime_seconds": 60,
    "output_to_quarantine": true,
    "requires_network": true,
    "audit_level": "full",
    "notes": "HTTP fetch via the active persona route. Output quarantined before release."
  },
  {
    "id": "file-inspect",
    "display_name": "File Type Inspect (file)",
    "category": "forensics",
    "binary_path": "/usr/bin/file",
    "allowed_personas": [],
    "denied_personas": [],
    "denied_security_modes": [],
    "max_runtime_seconds": 10,
    "output_to_quarantine": false,
    "requires_network": false,
    "audit_level": "minimal",
    "notes": "Identifies file type via magic bytes. Safe for all personas and modes."
  },
  {
    "id": "strings-extract",
    "display_name": "String Extraction (strings)",
    "category": "forensics",
    "binary_path": "/usr/bin/strings",
    "allowed_personas": [],
    "denied_personas": [],
    "denied_security_modes": [],
    "max_runtime_seconds": 30,
    "output_to_quarantine": false,
    "requires_network": false,
    "audit_level": "standard",
    "notes": "Extracts printable strings from binary files. Useful for malware triage."
  },
  {
    "id": "openssl-x509",
    "display_name": "Certificate Inspector (openssl)",
    "category": "crypto",
    "binary_path": "/usr/bin/openssl",
    "allowed_personas": ["anonymous", "red_team"],
    "denied_personas": [],
    "denied_security_modes": ["casual"],
    "max_runtime_seconds": 15,
    "output_to_quarantine": false,
    "requires_network": false,
    "audit_level": "standard",
    "notes": "Inspects X.509 certificates. Input is expected to be a PEM file path."
  }
]
